{
  "id": "texas-de-brazil-ala-moana-a32e6d",
  "name": "Texas de Brazil (Ala Moana Center)",
  "category": "food",
  "subcategory": "restaurant",
  "discount": "20% off food and non-alcoholic beverages on Tuesday dinner (kamaaina rate)",
  "conditions": "show valid Hawaii state photo ID; Tuesday dinner only",
  "redemption": "show_id",
  "requires_id": true,
  "code": null,
  "address": "1450 Ala Moana Boulevard, Ala Moana Center, Honolulu, HI 96814",
  "lat": 21.2911,
  "lng": -157.8434,
  "neighborhood": "Ala Moana",
  "source_url": "https://www.alamoanacenter.com/en/shopping/kamaainadiscounts/",
  "last_verified": "2026-06-21",
  "status": "active"
}
