{
  "id": "body-balance-ala-moana-9863e6",
  "name": "Body Balance (Ala Moana Center)",
  "category": "service",
  "subcategory": "fitness",
  "discount": "3 free trial classes (kamaaina offer)",
  "conditions": "show valid Hawaii state ID; text the word FREE to 808-542-9597 to redeem",
  "redemption": "code",
  "requires_id": true,
  "code": "FREE",
  "address": "1450 Ala Moana Boulevard, Ala Moana Center, Honolulu, HI 96814",
  "lat": 21.2911,
  "lng": -157.8434,
  "neighborhood": "Ala Moana",
  "source_url": "https://www.alamoanacenter.com/en/shopping/kamaainadiscounts/",
  "last_verified": "2026-06-21",
  "status": "active"
}
